<!ELEMENT liga (partido*)>
<!ELEMENT partido (equipo_local, equipo_visitante, goles_local, goles_visitante)>
<!ELEMENT equipo_local (#PCDATA)>
<!ELEMENT equipo_visitante (#PCDATA)>
<!ELEMENT goles_local (#PCDATA)>
<!ELEMENT goles_visitante (#PCDATA)>
